{
  "authority_note": "Index of generated convenience packets; cited authored sources remain authority.",
  "canonical_url": "https://westkitty.github.io/Starsilk_Character_Dossier/discover/context-packets.json",
  "packet_count": 127,
  "packet_pattern": "https://westkitty.github.io/Starsilk_Character_Dossier/discover/packets/<stable-id>.json",
  "packets": [
    {
      "canonical_url": "https://westkitty.github.io/Starsilk_Character_Dossier/entities/cover/",
      "display_label": "Visual reference",
      "packet_url": "https://westkitty.github.io/Starsilk_Character_Dossier/discover/packets/cover.json",
      "stable_id": "cover"
    },
    {
      "canonical_url": "https://westkitty.github.io/Starsilk_Character_Dossier/entities/world/",
      "display_label": "The All is programmable. Meaning is not optional.",
      "packet_url": "https://westkitty.github.io/Starsilk_Character_Dossier/discover/packets/world.json",
      "stable_id": "world"
    },
    {
      "canonical_url": "https://westkitty.github.io/Starsilk_Character_Dossier/entities/chronology/",
      "display_label": "Reality begins as betrayal. The future is built by exclusion.",
      "packet_url": "https://westkitty.github.io/Starsilk_Character_Dossier/discover/packets/chronology.json",
      "stable_id": "chronology"
    },
    {
      "canonical_url": "https://westkitty.github.io/Starsilk_Character_Dossier/entities/shard-god/",
      "display_label": "Shard-God Tiger",
      "packet_url": "https://westkitty.github.io/Starsilk_Character_Dossier/discover/packets/shard-god.json",
      "stable_id": "shard-god"
    },
    {
      "canonical_url": "https://westkitty.github.io/Starsilk_Character_Dossier/entities/codec/",
      "display_label": "Codec",
      "packet_url": "https://westkitty.github.io/Starsilk_Character_Dossier/discover/packets/codec.json",
      "stable_id": "codec"
    },
    {
      "canonical_url": "https://westkitty.github.io/Starsilk_Character_Dossier/entities/dao/",
      "display_label": "Dao",
      "packet_url": "https://westkitty.github.io/Starsilk_Character_Dossier/discover/packets/dao.json",
      "stable_id": "dao"
    },
    {
      "canonical_url": "https://westkitty.github.io/Starsilk_Character_Dossier/entities/kail/",
      "display_label": "Kail",
      "packet_url": "https://westkitty.github.io/Starsilk_Character_Dossier/discover/packets/kail.json",
      "stable_id": "kail"
    },
    {
      "canonical_url": "https://westkitty.github.io/Starsilk_Character_Dossier/entities/marcel/",
      "display_label": "Marcel",
      "packet_url": "https://westkitty.github.io/Starsilk_Character_Dossier/discover/packets/marcel.json",
      "stable_id": "marcel"
    },
    {
      "canonical_url": "https://westkitty.github.io/Starsilk_Character_Dossier/entities/jazen/",
      "display_label": "Jazen",
      "packet_url": "https://westkitty.github.io/Starsilk_Character_Dossier/discover/packets/jazen.json",
      "stable_id": "jazen"
    },
    {
      "canonical_url": "https://westkitty.github.io/Starsilk_Character_Dossier/entities/starsilk-material/",
      "display_label": "Starsilk",
      "packet_url": "https://westkitty.github.io/Starsilk_Character_Dossier/discover/packets/starsilk-material.json",
      "stable_id": "starsilk-material"
    },
    {
      "canonical_url": "https://westkitty.github.io/Starsilk_Character_Dossier/entities/gorevault/",
      "display_label": "Gorevault",
      "packet_url": "https://westkitty.github.io/Starsilk_Character_Dossier/discover/packets/gorevault.json",
      "stable_id": "gorevault"
    },
    {
      "canonical_url": "https://westkitty.github.io/Starsilk_Character_Dossier/entities/ringthroat/",
      "display_label": "Ringthroat",
      "packet_url": "https://westkitty.github.io/Starsilk_Character_Dossier/discover/packets/ringthroat.json",
      "stable_id": "ringthroat"
    },
    {
      "canonical_url": "https://westkitty.github.io/Starsilk_Character_Dossier/entities/lyriboris/",
      "display_label": "Lyriboris",
      "packet_url": "https://westkitty.github.io/Starsilk_Character_Dossier/discover/packets/lyriboris.json",
      "stable_id": "lyriboris"
    },
    {
      "canonical_url": "https://westkitty.github.io/Starsilk_Character_Dossier/entities/drakken-registry/",
      "display_label": "The full field register.",
      "packet_url": "https://westkitty.github.io/Starsilk_Character_Dossier/discover/packets/drakken-registry.json",
      "stable_id": "drakken-registry"
    },
    {
      "canonical_url": "https://westkitty.github.io/Starsilk_Character_Dossier/entities/mother/",
      "display_label": "Mother",
      "packet_url": "https://westkitty.github.io/Starsilk_Character_Dossier/discover/packets/mother.json",
      "stable_id": "mother"
    },
    {
      "canonical_url": "https://westkitty.github.io/Starsilk_Character_Dossier/entities/drk-the-egg/",
      "display_label": "The Egg",
      "packet_url": "https://westkitty.github.io/Starsilk_Character_Dossier/discover/packets/drk-the-egg.json",
      "stable_id": "drk-the-egg"
    },
    {
      "canonical_url": "https://westkitty.github.io/Starsilk_Character_Dossier/entities/drk-magma-pleuron/",
      "display_label": "Magma Pleuron",
      "packet_url": "https://westkitty.github.io/Starsilk_Character_Dossier/discover/packets/drk-magma-pleuron.json",
      "stable_id": "drk-magma-pleuron"
    },
    {
      "canonical_url": "https://westkitty.github.io/Starsilk_Character_Dossier/entities/drk-granithelion/",
      "display_label": "Granithelion",
      "packet_url": "https://westkitty.github.io/Starsilk_Character_Dossier/discover/packets/drk-granithelion.json",
      "stable_id": "drk-granithelion"
    },
    {
      "canonical_url": "https://westkitty.github.io/Starsilk_Character_Dossier/entities/drk-fault-tongue/",
      "display_label": "Fault-Tongue",
      "packet_url": "https://westkitty.github.io/Starsilk_Character_Dossier/discover/packets/drk-fault-tongue.json",
      "stable_id": "drk-fault-tongue"
    },
    {
      "canonical_url": "https://westkitty.github.io/Starsilk_Character_Dossier/entities/drk-obsidian-gul/",
      "display_label": "Obsidian Gul",
      "packet_url": "https://westkitty.github.io/Starsilk_Character_Dossier/discover/packets/drk-obsidian-gul.json",
      "stable_id": "drk-obsidian-gul"
    },
    {
      "canonical_url": "https://westkitty.github.io/Starsilk_Character_Dossier/entities/drk-tremorhound/",
      "display_label": "Tremorhound",
      "packet_url": "https://westkitty.github.io/Starsilk_Character_Dossier/discover/packets/drk-tremorhound.json",
      "stable_id": "drk-tremorhound"
    },
    {
      "canonical_url": "https://westkitty.github.io/Starsilk_Character_Dossier/entities/drk-glassspine/",
      "display_label": "Glassspine",
      "packet_url": "https://westkitty.github.io/Starsilk_Character_Dossier/discover/packets/drk-glassspine.json",
      "stable_id": "drk-glassspine"
    },
    {
      "canonical_url": "https://westkitty.github.io/Starsilk_Character_Dossier/entities/drk-quarrymind/",
      "display_label": "Quarrymind",
      "packet_url": "https://westkitty.github.io/Starsilk_Character_Dossier/discover/packets/drk-quarrymind.json",
      "stable_id": "drk-quarrymind"
    },
    {
      "canonical_url": "https://westkitty.github.io/Starsilk_Character_Dossier/entities/drk-aerokarst/",
      "display_label": "Aerokarst",
      "packet_url": "https://westkitty.github.io/Starsilk_Character_Dossier/discover/packets/drk-aerokarst.json",
      "stable_id": "drk-aerokarst"
    },
    {
      "canonical_url": "https://westkitty.github.io/Starsilk_Character_Dossier/entities/drk-cloudmaw/",
      "display_label": "Cloudmaw",
      "packet_url": "https://westkitty.github.io/Starsilk_Character_Dossier/discover/packets/drk-cloudmaw.json",
      "stable_id": "drk-cloudmaw"
    },
    {
      "canonical_url": "https://westkitty.github.io/Starsilk_Character_Dossier/entities/drk-atmantid/",
      "display_label": "Atmantid",
      "packet_url": "https://westkitty.github.io/Starsilk_Character_Dossier/discover/packets/drk-atmantid.json",
      "stable_id": "drk-atmantid"
    },
    {
      "canonical_url": "https://westkitty.github.io/Starsilk_Character_Dossier/entities/drk-weathernode/",
      "display_label": "Weathernode",
      "packet_url": "https://westkitty.github.io/Starsilk_Character_Dossier/discover/packets/drk-weathernode.json",
      "stable_id": "drk-weathernode"
    },
    {
      "canonical_url": "https://westkitty.github.io/Starsilk_Character_Dossier/entities/drk-vortenbray/",
      "display_label": "Vortenbray",
      "packet_url": "https://westkitty.github.io/Starsilk_Character_Dossier/discover/packets/drk-vortenbray.json",
      "stable_id": "drk-vortenbray"
    },
    {
      "canonical_url": "https://westkitty.github.io/Starsilk_Character_Dossier/entities/drk-fumericus/",
      "display_label": "Fumericus",
      "packet_url": "https://westkitty.github.io/Starsilk_Character_Dossier/discover/packets/drk-fumericus.json",
      "stable_id": "drk-fumericus"
    },
    {
      "canonical_url": "https://westkitty.github.io/Starsilk_Character_Dossier/entities/drk-skymourn/",
      "display_label": "Skymourn",
      "packet_url": "https://westkitty.github.io/Starsilk_Character_Dossier/discover/packets/drk-skymourn.json",
      "stable_id": "drk-skymourn"
    },
    {
      "canonical_url": "https://westkitty.github.io/Starsilk_Character_Dossier/entities/drk-verdgorge/",
      "display_label": "Verdgorge",
      "packet_url": "https://westkitty.github.io/Starsilk_Character_Dossier/discover/packets/drk-verdgorge.json",
      "stable_id": "drk-verdgorge"
    },
    {
      "canonical_url": "https://westkitty.github.io/Starsilk_Character_Dossier/entities/drk-pollenvault/",
      "display_label": "Pollenvault",
      "packet_url": "https://westkitty.github.io/Starsilk_Character_Dossier/discover/packets/drk-pollenvault.json",
      "stable_id": "drk-pollenvault"
    },
    {